symbol,exchange,type,organ_short_name,organ_name
YTC,UPCOM,STOCK,XNK Y tế TP.HCM,Công ty Cổ phần Xuất nhập khẩu Y tế Thành phố Hồ Chí Minh
YEG,HSX,STOCK,Tập đoàn Yeah1,Công ty Cổ phần Tập đoàn Yeah1
YBM,HSX,STOCK,Khoáng sản CN Yên Bái,Công ty Cổ phần Khoáng sản Công nghiệp Yên Bái
YBC,UPCOM,STOCK,Xi măng và Khoáng sản Yên Bái,Công ty Cổ phần Xi măng và Khoáng sản Yên Bái
XPH,UPCOM,STOCK,Xà phòng Hà Nội,Công ty Cổ phần Xà phòng Hà Nội
XMP,UPCOM,STOCK,Thủy điện Xuân Minh,Công ty Cổ phần Thủy điện Xuân Minh
XMD,UPCOM,STOCK,Xuân Mai - Đạo Tú,Công ty Cổ phần Xuân Mai - Đạo Tú
XMC,UPCOM,STOCK,Bê tông Xuân Mai,Công ty cổ phần Đầu tư và Xây dựng Xuân Mai
XLV,UPCOM,STOCK,XL và DV Sông Đà,Công ty Cổ phần Xây lắp và Dịch vụ Sông Đà
XHC,UPCOM,STOCK,Nội thất Xuân Hòa,Công ty Cổ phần Xuân Hòa Việt Nam
XDH,UPCOM,STOCK,Đầu tư XD Dân dụng Hà Nội,Công ty Cổ phần Đầu tư Xây dựng Dân dụng Hà Nội
XDC,DELISTED,STOCK,Xây dựng Công trình Tân Cảng,Công ty Cổ phần Xây dựng Công trình Tân Cảng
X77,UPCOM,STOCK,Thành An 77,Công ty Cổ phần Thành An 77
X26,UPCOM,STOCK,Công ty 26,Công ty Cổ phần 26
X20,HNX,STOCK,May mặc X20,Công ty Cổ phần X20
WTC,UPCOM,STOCK,Vận tải thủy Vinacomin,Công ty Cổ phần Vận tải thủy - Vinacomin
WSS,HNX,STOCK,Chứng khoán Phố Wall,Công ty Cổ phần Chứng khoán Phố Wall
WSB,UPCOM,STOCK,Bia Sài Gòn - Miền Tây,Công ty Cổ phần Bia Sài Gòn - Miền Tây
WCS,HNX,STOCK,Bến xe Miền Tây,Công ty Cổ phần Bến xe Miền Tây
VXT,UPCOM,STOCK,Kho vận và DV Thương mại,Công ty Cổ phần Kho vận và dịch vụ thương mại
VXP,UPCOM,STOCK,Thuốc Thú y Trung ương VETVACO,Công ty Cổ phần Thuốc Thú y Trung ương VETVACO
VXB,UPCOM,STOCK,VLXD Bến Tre,Công ty Cổ phần Vật liệu xây dựng Bến Tre
VWS,UPCOM,STOCK,Nước và Môi trường VN,Công ty Cổ phần Nước và Môi trường Việt Nam
VW3,UPCOM,STOCK,VIWASEEN.3,Công ty Cổ phần VIWASEEN3
VVS,UPCOM,STOCK,Đầu tư Phát triển Máy Việt Nam,Công ty Cổ phần Đầu tư Phát triển Máy Việt Nam
VVN,UPCOM,STOCK,XD Công nghiệp Việt Nam,Tổng Công ty Cổ phần Xây dựng Công nghiệp Việt Nam
VUA,UPCOM,STOCK,Chứng khoán Stanley Brothers,Công ty Cổ phần Chứng khoán Stanley Brothers
VTZ,HNX,STOCK,Nhựa Việt Thành,Công ty Cổ phần Sản xuất và Thương mại Nhựa Việt Thành
VTX,UPCOM,STOCK,Vận tải Đa phương thức,Công ty Cổ phần Vận tải Đa phương thức VIETRANSTIMEX
VTV,HNX,STOCK,Năng lượng và Môi trường VICEM,Công ty Cổ phần Năng lượng và Môi trường VICEM
VTS,UPCOM,STOCK,Gạch Ngói Từ Sơn,Công ty Cổ phần Gạch Ngói Từ Sơn
VTR,UPCOM,STOCK,Du lịch Vietravel,Công ty Cổ phần Du lịch và tiếp thị giao thông vận tải Việt Nam - Vietravel
VTQ,UPCOM,STOCK,Việt Trung Quảng Bình,Công ty Cổ phần Việt Trung Quảng Bình
VTP,HSX,STOCK,Bưu chính Viettel,Tổng Công ty Cổ phần Bưu chính Viettel
VTO,HSX,STOCK,VITACO,Công ty Cổ phần Vận tải Xăng dầu VITACO
VTM,UPCOM,STOCK,Đưa đón thợ mỏ - Vinacomin,Công ty Cổ phần Vận tải và Đưa đón thợ mỏ - Vinacomin
VTL,UPCOM,STOCK,Vang Thăng Long,Công ty Cổ phần Vang Thăng Long
VTK,UPCOM,STOCK,Tư vấn thiết kế Viettel,Công ty Cổ phần Tư vấn và Dịch vụ Viettel
VTJ,HNX,STOCK,TM và Đầu tư VINATABA,Công ty Cổ phần Thương mại và Đầu tư VI NA TA BA
VTI,UPCOM,STOCK,Sản xuất - XNK Dệt may,Công ty Cổ phần Sản xuất - Xuất nhập khẩu Dệt may
VTH,HNX,STOCK,Dây cáp điện Việt Thái,Công ty Cổ phần Dây cáp điện Việt Thái
VTG,UPCOM,STOCK,Du lịch tỉnh BR-VT,Công ty Cổ phần Du lịch tỉnh Bà Rịa - Vũng Tàu
VTE,UPCOM,STOCK,VINACAP Kim Long,Công ty Cổ phần VINACAP Kim Long
VTD,UPCOM,STOCK,Du lịch Vietourist,Công ty Cổ phần Vietourist Holdings
VTC,HNX,STOCK,Viễn thông VTC,Công ty Cổ phần Viễn Thông VTC
VTB,HSX,STOCK,Viettronics Tân Bình,Công ty Cổ phần Viettronics Tân Bình
VTA,UPCOM,STOCK,Gạch men VITALY,Công ty Cổ phần VITALY
VST,UPCOM,STOCK,Vận tải và Thuê Tàu biển Việt Nam,Công ty Cổ phần Vận tải và Thuê Tàu biển Việt Nam
VSP,DELISTED,STOCK,ShinPetrol,Công ty Cổ phần Vận tải biển và Bất động sản Việt Hải
VSN,UPCOM,STOCK,VN Kỹ Nghệ Súc Sản (VISSAN),Công ty Cổ phần Việt Nam Kỹ Nghệ Súc Sản
VSM,HNX,STOCK,Container Miền Trung,Công ty Cổ phần Container Miền Trung
VSI,HSX,STOCK,Đầu tư và Xây dựng Cấp thoát nước,Công ty Cổ phần Đầu tư và Xây dựng Cấp thoát nước
VSH,HSX,STOCK,Thủy điện Vĩnh Sơn - Sông Hinh,Công ty Cổ phần Thủy điện Vĩnh Sơn - Sông Hinh
VSG,UPCOM,STOCK,Container Phía Nam,Công ty Cổ phần Container Phía Nam
VSF,UPCOM,STOCK,Vinafood 2,Tổng Công ty Lương thực Miền Nam - Công ty Cổ phần
VSE,UPCOM,STOCK,DV Đường cao tốc Việt Nam,Công ty Cổ phần Dịch vụ Đường cao tốc Việt Nam
VSC,HSX,STOCK,VICONSHIP,Công ty Cổ phần Container Việt Nam
VSA,HNX,STOCK,Đại lý Hàng hải VN,Công ty Cổ phần Đại lý Hàng hải Việt Nam
VRG,UPCOM,STOCK,PT Đô thị và KCN Cao su VN,Công ty Cổ phần Phát triển Đô thị và Khu Công nghiệp Cao Su Việt Nam
VRE12007,BOND,BOND,VRE12007 - Trái phiếu,VRE12007 - Trái phiếu
VRE,HSX,STOCK,Vincom Retail,Công ty Cổ phần Vincom Retail
VRC,HSX,STOCK,Bất động sản và Đầu tư VRC,Công ty Cổ phần Bất động sản và Đầu tư VRC
VQC,UPCOM,STOCK,Giám định Vinaconmin,Công ty Cổ phần Giám định Vinaconmin
VPW,UPCOM,STOCK,Cấp thoát nước số 1 Vĩnh Phúc,Công ty Cổ phần Cấp thoát nước số 1 Vĩnh Phúc
VPS,HSX,STOCK,Thuốc sát trùng Việt Nam,Công ty Cổ phần Thuốc sát trùng Việt Nam
VPR,UPCOM,STOCK,VINAPRINT,Công ty Cổ phần VINAPRINT
VPI124001,BOND,BOND,VPI124001 - Trái phiếu,VPI124001 - Trái phiếu
VPI,HSX,STOCK,Đầu tư Văn Phú - Invest,Công ty Cổ phần Đầu tư Văn Phú - Invest
VPH,HSX,STOCK,Vạn Phát Hưng,Công ty Cổ phần Vạn Phát Hưng
VPG,HSX,STOCK,Đầu tư TMại XNK Việt Phát,Công ty Cổ phần Đầu tư Thương mại Xuất nhập khẩu Việt Phát
VPD,HSX,STOCK,Phát triển Điện lực Việt Nam,Công ty Cổ phần Phát triển Điện lực Việt Nam
VPC,UPCOM,STOCK,V- Power,Công ty Cổ phần Đầu tư và Phát triển Năng lượng Việt Nam
VPB,HSX,STOCK,VPBank,Ngân hàng Thương mại Cổ phần Việt Nam Thịnh Vượng
VPA,UPCOM,STOCK,Vận tải Hóa dầu VP,Công ty Cổ phần Vận tải Hóa dầu VP
VOS,HSX,STOCK,Vận tải Biển Việt Nam,Công ty Cổ phần Vận tải Biển Việt Nam
VOC,UPCOM,STOCK,Dầu thực vật Việt Nam,Tổng Công ty Công nghiệp Dầu thực vật Việt Nam - Công ty Cổ phần
VNZ,UPCOM,STOCK,CTCP VNG,Công ty Cổ phần VNG
VNY,UPCOM,STOCK,Thuốc thú y Trung ương I,Công ty Cổ phần Thuốc thú y Trung ương I
VNX,UPCOM,STOCK,QC và Hội chợ Thương mại,Công ty Cổ phần Quảng cáo và Hội chợ Thương mại Vinexad
VNT421032,DELISTED,BOND,VNT421032 - Trái phiếu,VNT421032 - Trái phiếu
VNT,HNX,STOCK,Vận tải ngoại thương,Công ty Cổ phần Giao nhận Vận tải Ngoại Thương
VNS,HSX,STOCK,Ánh Dương Việt Nam,Công ty Cổ phần Ánh Dương Việt Nam
VNR,HNX,STOCK,Tái bảo hiểm Quốc gia,Tổng Công ty Cổ phần Tái bảo hiểm Quốc gia Việt Nam
VNP,UPCOM,STOCK,Nhựa Việt Nam,Công ty Cổ phần Nhựa Việt Nam
VNM,HSX,STOCK,VINAMILK,Công ty Cổ phần Sữa Việt Nam
VNL,HSX,STOCK,Vinalink Logistics,Công ty Cổ phần Logistics Vinalink
VNI,UPCOM,STOCK,ĐT BĐS Việt Nam,Công ty Cổ phần Đầu tư Bất động sản Việt Nam
VNH,UPCOM,STOCK,Đầu tư Việt Việt Nhật,Công ty Cổ phần Đầu tư Việt Việt Nhật
VNG122002,DELISTED,BOND,VNG122002 - Trái phiếu,VNG122002 - Trái phiếu
VNG,HSX,STOCK,DL Thành Thành Công,Công ty Cổ phần Du Lịch Thành Thành Công
VNF,HNX,STOCK,VINAFREIGHT,Công ty Cổ phần Vinafreight
VNE,HSX,STOCK,Xây dựng điện Việt Nam,Tổng Công ty Cổ phần Xây dựng điện Việt Nam
VND122014,DELISTED,BOND,VND122014 - Trái phiếu,VND122014 - Trái phiếu
VND122013,DELISTED,BOND,VND122013 - Trái phiếu,VND122013 - Trái phiếu
VND122012,DELISTED,BOND,VND122012 - Trái phiếu,VND122012 - Trái phiếu
VND,HSX,STOCK,Chứng khoán VNDIRECT,Công ty Cổ phần Chứng khoán VNDIRECT
VNC,HNX,STOCK,VINACONTROL,Công ty Cổ phần Tập đoàn Vinacontrol
VNB,UPCOM,STOCK,Sách Việt Nam,Công ty Cổ phần Sách Việt Nam
VNA,UPCOM,STOCK,Vận tải biển Vinaship,Công ty Cổ phần Vận tải biển Vinaship
VN30F2509,HNX,FU,VN30F2509 - HĐTL,VN30F2509 - HĐTL
VN30F2506,HNX,FU,VN30F2506 - HĐTL,VN30F2506 - HĐTL
VN30F2505,HNX,FU,VN30F2505 - HĐTL,VN30F2505 - HĐTL
VN30F2504,HNX,FU,VN30F2504 - HĐTL,VN30F2504 - HĐTL
VN30F2503,DELISTED,FU,VN30F2503 - HĐTL,VN30F2503 - HĐTL
VN30F2502,DELISTED,FU,VN30F2502 - HĐTL,VN30F2502 - HĐTL
VN30F2501,DELISTED,FU,VN30F2501 - HĐTL,VN30F2501 - HĐTL
VN30F2412,DELISTED,FU,VN30F2412 - HĐTL,VN30F2412 - HĐTL
VN30F2411,DELISTED,FU,VN30F2411 - HĐTL,VN30F2411 - HĐTL
VN30F2410,DELISTED,FU,VN30F2410 - HĐTL,VN30F2410 - HĐTL
VN30F2409,DELISTED,FU,VN30F2409 - HĐTL,VN30F2409 - HĐTL
VN30F2408,DELISTED,FU,VN30F2408 - HĐTL,VN30F2408 - HĐTL
VN30F2407,DELISTED,FU,VN30F2407 - HĐTL,VN30F2407 - HĐTL
VN30F2406,DELISTED,FU,VN30F2406 - HĐTL,VN30F2406 - HĐTL
VN30F2405,DELISTED,FU,VN30F2405 - HĐTL,VN30F2405 - HĐTL
VN30F2404,DELISTED,FU,VN30F2404 - HĐTL,VN30F2404 - HĐTL
VN30F2403,DELISTED,FU,VN30F2403 - HĐTL,VN30F2403 - HĐTL
VN30F2402,DELISTED,FU,VN30F2402 - HĐTL,VN30F2402 - HĐTL
VN30F2401,DELISTED,FU,VN30F2401 - HĐTL,VN30F2401 - HĐTL
VMT,UPCOM,STOCK,Giao nhận Vận tải Miền Trung,Công ty Cổ phần Giao nhận Vận tải Miền Trung
VMS,HNX,STOCK,Phát triển Hàng Hải,Công ty Cổ phần Phát triển Hàng Hải
VMK,UPCOM,STOCK,Vimarko,Công ty Cổ phần Vimarko
VMI,DELISTED,STOCK,KS và Đầu tư VISACO,Công ty Cổ phần Khoáng sản và Đầu tư VISACO
VMG,UPCOM,STOCK,Vimexco Gas,Công ty Cổ phần Thương mại và Dịch vụ Dầu khí Vũng Tàu
VMD,HSX,STOCK,Y Dược phẩm Vimedimex,Công ty Cổ phần Y Dược phẩm Vimedimex
VMC,HNX,STOCK,VIMECO,Công ty Cổ phần VIMECO
VMA,UPCOM,STOCK,CN Ô tô - Vinacomin,Công ty Cổ phần Công nghiệp Ô tô - Vinacomin
VLW,UPCOM,STOCK,Cấp nước Vĩnh Long,Công ty Cổ phần Cấp nước Vĩnh Long
VLP,UPCOM,STOCK,Công trình Công cộng Vĩnh Long,Công ty Cổ phần Công trình Công cộng Vĩnh Long
VLG,UPCOM,STOCK,VIMC Logistics,Công ty Cổ phần VIMC Logistics
VLF,UPCOM,STOCK,Lương thực Vĩnh Long,Công ty Cổ phần Lương thực Thực phẩm Vĩnh Long
VLC,UPCOM,STOCK,Chăn nuôi Việt Nam,Tổng Công ty Chăn nuôi Việt Nam - Công ty Cổ phần
VLB,UPCOM,STOCK,VLXD Biên Hòa,Công ty Cổ phần Xây dựng và Sản xuất Vật liệu Xây dựng Biên Hòa
VLA,HNX,STOCK,PT Công nghệ Văn Lang,Công ty Cổ phần Đầu tư và Phát triển Công nghệ Văn Lang
VKP,UPCOM,STOCK,Nhựa Tân Hóa,Công ty Cổ phần Nhựa Tân Hóa
VKD,DELISTED,STOCK,Nước khoáng Khánh Hòa,Công ty Cổ phần Nước khoáng Khánh Hòa
VKC,UPCOM,STOCK,VKC Holdings,Công ty Cổ phần VKC Holdings
VJC,HSX,STOCK,Vietjet Air,Công ty Cổ phần Hàng không Vietjet
VIX,HSX,STOCK,Chứng khoán VIX,Công ty Cổ phần Chứng khoán VIX
VIW,UPCOM,STOCK,Đầu tư nước và môi trường VN - Viwaseen,Tổng công ty Đầu tư Nước và Môi trường Việt Nam - Công ty Cổ phần
VIT,HNX,STOCK,Viglacera Tiên Sơn,Công ty Cổ phần Viglacera Tiên Sơn
VIS,DELISTED,STOCK,Thép Việt Ý,Công ty Cổ phần Thép Việt Ý
VIR,UPCOM,STOCK,Du lịch Vũng Tàu,Công ty Cổ phần Du lịch Quốc tế Vũng Tàu
VIP,HSX,STOCK,Vận tải Xăng dầu VIPCO,Công ty Cổ phần Vận tải Xăng dầu VIPCO
VIN,UPCOM,STOCK,Kho vận ngoại thương VN,Công ty Cổ phần Giao nhận Kho vận Ngoại thương Việt Nam
VIM,UPCOM,STOCK,Khoáng sản Viglacera,Công ty Cổ phần Khoáng sản Viglacera
VIH,UPCOM,STOCK,Viglacera Hà Nội,Công ty Cổ phần Viglacera Hà Nội
VIG,HNX,STOCK,Chứng khoán Đầu tư Tài chính Việt Nam,Công ty Cổ phần Chứng khoán Đầu tư Tài chính Việt Nam
VIF,HNX,STOCK,Lâm nghiệp Việt Nam,Tổng Công ty Lâm nghiệp Việt Nam - Công ty Cổ phần
VIE,UPCOM,STOCK,CN Viễn thông VI TE CO,Công ty Cổ phần Công nghệ Viễn thông VI TE CO
VID,HSX,STOCK,Viễn Đông,Công ty Cổ phần Đầu tư Phát triển Thương mại Viễn Đông
VIC124005,BOND,BOND,VIC124005 - Trái phiếu,VIC124005 - Trái phiếu
VIC124004,BOND,BOND,VIC124004 - Trái phiếu,VIC124004 - Trái phiếu
VIC124003,BOND,BOND,VIC124003 - Trái phiếu,VIC124003 - Trái phiếu
VIC123029,BOND,BOND,VIC123029 - Trái phiếu,VIC123029 - Trái phiếu
VIC123028,BOND,BOND,VIC123028 - Trái phiếu,VIC123028 - Trái phiếu
VIC121005,DELISTED,BOND,VIC121005 - Trái phiếu,VIC121005 - Trái phiếu
VIC121004,DELISTED,BOND,VIC121004 - Trái phiếu,VIC121004 - Trái phiếu
VIC121003,DELISTED,BOND,VIC121003 - Trái phiếu,VIC121003 - Trái phiếu
VIC,HSX,STOCK,VinGroup,Tập đoàn Vingroup - Công ty CP
VIB,HSX,STOCK,VIBBank,Ngân hàng Thương mại Cổ phần Quốc tế Việt Nam
VHM121025,BOND,BOND,VHM121025 - Trái phiếu,VHM121025 - Trái phiếu
VHM121024,DELISTED,BOND,VHM121024 - Trái phiếu,VHM121024 - Trái phiếu
VHM,HSX,STOCK,Vinhomes,Công ty Cổ phần Vinhomes
VHL,HNX,STOCK,Viglacera Hạ Long,Công ty Cổ phần Viglacera Hạ Long
VHI,DELISTED,STOCK,,
VHH,UPCOM,STOCK,Kinh doanh nhà Thành Đạt,Công ty Cổ phần Đầu tư Kinh doanh nhà Thành Đạt
VHG,UPCOM,STOCK,Công ty Cổ phần Đầu tư và Phát triển Việt Trung Nam,Công ty Cổ phần Đầu tư và Phát triển Việt Trung Nam
VHF,UPCOM,STOCK,Chế biến lương thực Vĩnh Hà,Công ty Cổ phần Xây dựng và Chế biến lương thực Vĩnh Hà
VHE,HNX,STOCK,Dược liệu và Thực phẩm VN,Công ty Cổ phần Dược liệu và Thực phẩm Việt Nam
VHD,UPCOM,STOCK,PT Nhà và Đô thị Vinaconex,Công ty Cổ phần Đầu tư phát triển nhà và đô thị VINAHUD
VHC,HSX,STOCK,Thủy sản Vĩnh Hoàn,Công ty Cổ phần Vĩnh Hoàn
VGV,UPCOM,STOCK,Tư vấn Xây dựng Việt Nam,Tổng Công ty Tư vấn Xây dựng Việt Nam - CTCP
VGT,UPCOM,STOCK,VINATEX,Tập đoàn Dệt May Việt Nam
VGS,HNX,STOCK,Ống thép Việt Đức,Công ty Cổ phần Ống thép Việt - Đức VG PIPE
VGR,UPCOM,STOCK,Cảng xanh VIP,Công ty Cổ phần Cảng xanh VIP
VGP,HNX,STOCK,Cảng Rau Quả,Công ty Cổ phần Cảng Rau Quả
VGL,UPCOM,STOCK,Mạ kẽm công nghiệp Vingal-Vnsteel,Công ty Cổ phần Mạ kẽm công nghiệp Vingal-Vnsteel
VGI,UPCOM,STOCK,Đầu tư Quốc tế Viettel,Tổng Công ty Cổ phần Đầu tư Quốc tế Viettel
VGG,UPCOM,STOCK,May Việt Tiến,Tổng Công Ty Cổ phần May Việt Tiến
VGC,HSX,STOCK,Tổng Công ty Viglacera,Tổng Công ty Viglacera - Công ty Cổ phần
VFS,HNX,STOCK,Chứng khoán Nhất Việt,Công ty Cổ phần Chứng khoán Nhất Việt
VFR,UPCOM,STOCK,Vận tải Vietfracht,Công ty Cổ phần Vận tải và Thuê tàu
VFG,HSX,STOCK,Khử trùng Việt Nam,Công ty Cổ phần Khử trùng Việt Nam
VFC,UPCOM,STOCK,Vận tải biển VINAFCO,Công ty Cổ phần VINAFCO
VET,UPCOM,STOCK,Thuốc thú y trung ương Navetco,Công ty Cổ phần Thuốc Thú y Trung ương NAVETCO
VES,UPCOM,STOCK,MÊ CA VNECO,Công ty Cổ phần Đầu tư và Xây dựng Điện MÊ CA VNECO
VEF,UPCOM,STOCK,Hội chợ Triển lãm Việt Nam,Công ty Cổ phần Trung tâm Hội chợ Triển lãm Việt Nam
VEC,UPCOM,STOCK,Điện tử và Tin học VN,Tổng Công ty Cổ phần Điện tử và Tin học Việt Nam
VEA,UPCOM,STOCK,Máy động lực và Máy NN,Tổng Công ty Máy động lực và Máy nông nghiệp Việt Nam - CTCP
VE9,UPCOM,STOCK,VNECO 9,Công ty Cổ phần Đầu tư và Xây dựng VNECO 9
VE8,HNX,STOCK,Xây dựng Điện Vneco 8,Công ty Cổ phần Xây dựng Điện Vneco 8
VE4,HNX,STOCK,Xây dựng điện VNECO4,Công ty Cổ phần Xây dựng điện VNECO4
VE3,HNX,STOCK,Xây dựng điện VNECO 3,Công ty Cổ phần Xây dựng điện VNECO 3
VE2,UPCOM,STOCK,Xây dựng Điện VNECO 2,Công ty Cổ phần Xây dựng Điện VNECO 2
VE1,HNX,STOCK,VNECO 1,Công ty Cổ phần Xây dựng điện VNECO 1
VDT,UPCOM,STOCK,Lưới thép Bình Tây,Công ty Cổ phần Lưới thép Bình Tây
VDS,HSX,STOCK,Chứng khoán Rồng Việt,Công ty Cổ phần Chứng khoán Rồng Việt
VDP,HSX,STOCK,Dược phẩm VIDIPHA,Công ty Cổ phần Dược phẩm Trung ương VIDIPHA
VDN,UPCOM,STOCK,Vinatex Đà Nẵng,Công ty Cổ phần Vinatex Đà Nẵng
VDM,DELISTED,STOCK,Viện Nghiên cứu Dệt may,Công ty Cổ phần - Viện Nghiên cứu Dệt may
VDL,HNX,STOCK,Thực phẩm Lâm Đồng,Công ty Cổ phần Thực phẩm Lâm Đồng
VDG,UPCOM,STOCK,Vạn Đạt Group,Công ty Cổ phần Vạn Đạt Group
VDB,UPCOM,STOCK,Vận tải và CB Than Đông Bắc,Công ty Cổ phần Vận tải và Chế biến Than Đông Bắc
VCX,UPCOM,STOCK,Xi măng Yên Bình,Công ty Cổ phần Xi măng Yên Bình
VCW,UPCOM,STOCK,Đầu tư Nước sạch Sông Đà,Công ty Cổ phần Đầu tư Nước sạch Sông Đà
VCT,UPCOM,STOCK,Tư vấn XD Vinaconex,Công ty Cổ phần Tư vấn Xây dựng Vinaconex
VCS,HNX,STOCK,VICOSTONE,Công ty Cổ phần VICOSTONE
VCR,UPCOM,STOCK,Vinaconex - ITC,Công ty Cổ phần Đầu tư và Phát triển Du lịch Vinaconex
VCP,UPCOM,STOCK,Xây dựng và Năng lượng VCP,Công ty Cổ phần Xây dựng và Năng lượng VCP
VCM,HNX,STOCK,BV Life,Công ty Cổ phần BV Life
VCI,HSX,STOCK,Chứng khoán Vietcap,Công ty Cổ phần Chứng khoán Vietcap
VCG,HSX,STOCK,VINACONEX,Tổng Công ty Cổ phần Xuất nhập khẩu và Xây dựng Việt Nam
VCF,HSX,STOCK,VinaCafé Biên Hòa,Công ty Cổ phần VinaCafé Biên Hòa
VCE,UPCOM,STOCK,Xây lắp Môi trường,Công ty Cổ phần Xây lắp Môi trường
VCC,HNX,STOCK,Vinaconex 25,Công ty Cổ phần Vinaconex 25
VCB,HSX,STOCK,Vietcombank,Ngân hàng Thương mại Cổ phần Ngoại thương Việt Nam
VCA,HSX,STOCK,Thép VICASA - VNSTEEL,Công ty Cổ phần Thép VICASA - VNSTEEL
VC9,HNX,STOCK,Xây dựng số 9,Công ty Cổ phần Xây dựng số 9 - VC9
VC7,HNX,STOCK,BGI Group,Công ty Cổ phần Tập đoàn BGI
VC6,HNX,STOCK,Visicons,Công ty cổ phần Xây dựng và Đầu tư Visicons
VC5,UPCOM,STOCK,Xây dựng Số 5,Công ty Cổ phần Xây dựng Số 5
VC3,HNX,STOCK,Tập đoàn Nam Mê Kông,Công ty Cổ phần Tập đoàn Nam Mê Kông
VC2,HNX,STOCK,Đầu tư và Xây dựng VINA2,Công ty Cổ phần Đầu tư và Xây dựng VINA2
VC1,HNX,STOCK,Xây dựng số 1,Công ty Cổ phần Xây dựng số 1
VBH,UPCOM,STOCK,Điện tử Bình Hòa,Công ty Cổ phần Điện tử Bình Hòa
VBG,UPCOM,STOCK,Địa chất Việt Bắc - TKV,Công ty Cổ phần Địa chất Việt Bắc - TKV
VBC,HNX,STOCK,Nhựa - Bao bì Vinh,"Công ty Cổ phần Nhựa, Bao bì Vinh"
VBB124007,BOND,BOND,VBB124007 - Trái phiếu,VBB124007 - Trái phiếu
VBB123017,BOND,BOND,VBB123017 - Trái phiếu,VBB123017 - Trái phiếu
VBB122033,DELISTED,BOND,VBB122033 - Trái phiếu,VBB122033 - Trái phiếu
VBB,UPCOM,STOCK,VietBank,Ngân hàng Thương mại Cổ phần Việt Nam Thương Tín
VBA124019,BOND,BOND,VBA124019 - Trái phiếu,VBA124019 - Trái phiếu
VBA123036,BOND,BOND,VBA123036 - Trái phiếu,VBA123036 - Trái phiếu
VBA122001,BOND,BOND,VBA122001 - Trái phiếu,VBA122001 - Trái phiếu
VBA121033,BOND,BOND,VBA121033 - Trái phiếu,VBA121033 - Trái phiếu
VAV,UPCOM,STOCK,VIWACO,Công ty Cổ phần VIWACO
VAT,DELISTED,STOCK,Viễn thông Vạn Xuân,Công ty Cổ phần VT Vạn Xuân
VAF,HSX,STOCK,Phân lân Văn Điển,Công ty Cổ phần Phân lân nung chảy Văn Điển
VAB,UPCOM,STOCK,Ngân hàng Việt Á,Ngân hàng Thương mại Cổ phần Việt Á
V21,HNX,STOCK,Vinaconex 21,Công ty Cổ phần Vinaconex 21
V15,UPCOM,STOCK,Vinaconex 15,Công ty Cổ phần Xây dựng số 15
V12,HNX,STOCK,VINACONEX 12,Công ty Cổ phần Xây dựng số 12
V11,UPCOM,STOCK,VINACONEX No11,Công ty Cổ phần Xây dựng số 11
UXC,UPCOM,STOCK,Chế biến Thủy sản Út Xi,Công ty Cổ phần Chế biến Thủy sản Út Xi
USD,UPCOM,STOCK,Công trình Đô thị Sóc Trăng,Công ty Cổ phần Công trình Đô thị Sóc Trăng
USC,UPCOM,STOCK,Khảo sát và Xây dựng - USCO,Công ty Cổ phần Khảo sát và Xây dựng - USCO
UPH,UPCOM,STOCK,Dược phẩm TW25,Công ty Cổ phần Dược phẩm TW25
UPC,UPCOM,STOCK,Cây xanh Vũng Tàu,Công ty Cổ phần Phát triển Công viên Cây xanh và Đô thị Vũng Tàu
UNI,HNX,STOCK,Đầu tư và Phát triển Sao Mai Việt,Công ty Cổ phần Đầu tư và Phát triển Sao Mai Việt
UMC,UPCOM,STOCK,Công trình đô thị Nam Định,Công ty Cổ phần Công trình đô thị Nam Định
UIC,HSX,STOCK,Phát triển Nhà và Đô thị IDICO,Công ty Cổ phần Đầu tư Phát triển Nhà và Đô thị IDICO
UEM,UPCOM,STOCK,Cơ điện Uông Bí - Vinacomin,Công ty Cổ phần Cơ điện Uông Bí - Vinacomin
UDL,UPCOM,STOCK,Đô thị và Môi trường Đắk Lắk,Công ty Cổ phần Đô thị và Môi trường Đắk Lắk
UDJ,UPCOM,STOCK,Becamex UDJ,Công ty Cổ phần Phát triển Đô thị
UDC,UPCOM,STOCK,XD&PT Đô thị Bà Rịa - Vũng Tàu,Công ty Cổ phần Xây dựng và Phát triển đô thị Tỉnh Bà Rịa - Vũng Tàu
UCT,UPCOM,STOCK,Đô thị Cần Thơ,Công ty Cổ phần Đô thị Cần Thơ
TYA,HSX,STOCK,Dây và Cáp điện Taya,Công ty Cổ phần Dây và Cáp điện Taya Việt Nam
TXM,HNX,STOCK,Thạch cao Xi măng,Công ty Cổ phần VICEM Thạch cao Xi Măng
TW3,UPCOM,STOCK,Dược TW3,Công ty Cổ phần Dược Trung Ương 3
TVW,DELISTED,STOCK,Cấp thoát nước Trà Vinh,Công ty Cổ phần Cấp thoát nước Trà Vinh
TVT,HSX,STOCK,May Việt Thắng,Tổng Công ty Việt Thắng - CTCP
TVS,HSX,STOCK,Chứng khoán Thiên Việt,Công ty Cổ phần Chứng khoán Thiên Việt
TVP,DELISTED,STOCK,Dược phẩm TV.Pharm,Công ty Cổ phần Dược phẩm TV.Pharm
TVN,UPCOM,STOCK,Thép Việt Nam,Tổng Công ty Thép Việt Nam - Công ty Cổ phần
TVM,UPCOM,STOCK,Tư vấn đầu tư Mỏ,Công ty Cổ phần Tư vấn đầu tư Mỏ và công nghiệp - Vinacomin
TVH,UPCOM,STOCK,Tư vấn XD công trình Hàng hải,Công ty Cổ phần Tư vấn Xây dựng công trình Hàng hải
TVG,UPCOM,STOCK,XD Giao thông Vận tải,Công ty Cổ phần Tư vấn Đầu tư và Xây dựng Giao thông Vận tải
TVD,HNX,STOCK,Than Vàng Danh,Công ty Cổ phần Than Vàng Danh - Vinacomin
TVC,HNX,STOCK,Tập đoàn Trí Việt,Công ty Cổ phần Tập đoàn Quản lý Tài sản Trí Việt
TVB,HSX,STOCK,Chứng khoán Trí Việt,Công ty Cổ phần Chứng khoán Trí Việt
TVA,UPCOM,STOCK,Sứ Viglacera Thanh Trì,Công ty cổ phần Sứ Viglacera Thanh Trì
TV6,UPCOM,STOCK,TM ĐT xây lắp điện Thịnh Vượng,Công ty Cổ phần Tập đoàn EMA LAND
TV4,HNX,STOCK,Tư vấn XD Điện 4,Công ty Cổ phần Tư vấn Xây dựng Điện 4
TV3,HNX,STOCK,Tư vấn XD điện 3,Công ty Cổ phần Tư vấn Xây dựng Điện 3
TV2,HSX,STOCK,Tư vấn XD Điện 2,Công ty Cổ phần Tư vấn Xây dựng Điện 2
TV1,UPCOM,STOCK,Tư vấn XD Điện 1,Công ty Cổ phần Tư vấn Xây dựng Điện 1
TUG,UPCOM,STOCK,Lai dắt và VT cảng Hải Phòng,Công ty Cổ phần Lai dắt và Vận tải Cảng Hải Phòng
TTZ,UPCOM,STOCK,Xây dựng Tiến Trung,Công ty Cổ phần Đầu tư Xây dựng và Công nghệ Tiến Trung
TTT,HNX,STOCK,Du lịch - Thương Mại Tây Ninh,Công ty Cổ phần Du Lịch - Thương Mại Tây Ninh
TTS,UPCOM,STOCK,Cán thép Thái Trung,Công ty Cổ phần Cán thép Thái Trung
TTP,DELISTED,STOCK,Bao bì nhựa Tân Tiến,Công ty Cổ phần Bao bì Tân Tiến
TTN,UPCOM,STOCK,Công nghệ và Truyền thông VN,Công ty Cổ phần Công nghệ & Truyền thông Việt Nam
TTL,HNX,STOCK,TCT Thăng Long,Tổng Công ty Thăng Long - Công ty Cổ phần
TTH,HNX,STOCK,TM và DV Tiến Thành,Công ty Cổ phần Thương mại và Dịch vụ Tiến Thành
TTG,UPCOM,STOCK,May Thanh Trì,Công ty Cổ phần May Thanh Trì
TTF,HSX,STOCK,Gỗ Trường Thành,Công ty Cổ phần Tập đoàn Kỹ nghệ Gỗ Trường Thành
TTE,HSX,STOCK,ĐT Năng lượng Trường Thịnh,Công ty Cổ phần Đầu tư Năng lượng Trường Thịnh
TTD,UPCOM,STOCK,Bệnh viện Tim Tâm Đức,Công ty Cổ phần Bệnh viện Tim Tâm Đức
TTC,HNX,STOCK,Gạch men Thanh Thanh,Công ty Cổ phần Gạch men Thanh Thanh
TTB,UPCOM,STOCK,Tập đoàn Tiến Bộ,Công ty Cổ phần TTBGROUP
TTA,HSX,STOCK,XD và PT Trường Thành,Công ty Cổ phần Đầu tư Xây dựng và Phát triển Trường Thành
TT6,UPCOM,STOCK,Tien Thinh Group,Công ty Cổ Phần Tập Đoàn Tiến Thịnh
