symbol,exchange,type,organ_short_name,organ_name
HPT,UPCOM,STOCK,DV Công nghệ Tin học HPT,Công ty Cổ phần Dịch vụ Công nghệ Tin học HPT
HPP,UPCOM,STOCK,Sơn Hải Phòng,Công ty Cổ phần Sơn Hải Phòng
HPM,UPCOM,STOCK,Khoáng sản Hoàng Phúc,Công ty Cổ phần Xây dựng Thương mại và Khoáng sản Hoàng Phúc
HPI,UPCOM,STOCK,Khu công nghiệp Hiệp Phước,Công ty Cổ phần Khu công nghiệp Hiệp Phước
HPH,UPCOM,STOCK,Hóa Chất Hưng Phát Hà Bắc,Công ty Cổ phần Hóa Chất Hưng Phát Hà Bắc
HPG,HSX,STOCK,Hòa Phát,Công ty Cổ phần Tập đoàn Hòa Phát
HPD,UPCOM,STOCK,Thủy điện Đăk Đoa,Công ty Cổ phần Thủy điện Đăk Đoa
HPB,UPCOM,STOCK,Bao bì PP,Công ty Cổ phần Bao bì PP
HOT,UPCOM,STOCK,Du lịch - DV Hội An,Công ty Cổ phần Du lịch - Dịch vụ Hội An
HOM,HNX,STOCK,Xi măng VICEM Hoàng Mai,Công ty Cổ phần Xi măng VICEM Hoàng Mai
HNT,DELISTED,STOCK,Xe điện Hà Nội,Công ty Cổ phần Xe điện Hà Nội
HNR,UPCOM,STOCK,Cồn Rượu và Nước Giải Khát Hà Nội,Công ty Cổ phần Rượu và Nước Giải Khát Hà Nội
HNP,UPCOM,STOCK,Hanel Xốp Nhựa,Công ty Cổ phần Hanel Xốp Nhựa
HNM,UPCOM,STOCK,HANOIMILK,Công ty Cổ phần Sữa Hà Nội
HNI,UPCOM,STOCK,May Hữu Nghị,Công ty Cổ phần May Hữu Nghị
HNG,UPCOM,STOCK,Nông nghiệp Quốc tế HAGL,Công ty Cổ phần Nông nghiệp Quốc tế Hoàng Anh Gia Lai
HNF,UPCOM,STOCK,Bánh kẹo Hữu Nghị,Công ty Cổ phần Thực phẩm Hữu Nghị
HNE,DELISTED,STOCK,,
HND,UPCOM,STOCK,Nhiệt điện Hải Phòng,Công ty Cổ phần Nhiệt điện Hải Phòng
HNB,UPCOM,STOCK,Bến xe Hà Nội,Công ty Cổ phần Bến xe Hà Nội
HNA,HSX,STOCK,Thủy điện Hủa Na,Công ty Cổ phần Thủy điện Hủa Na
HMS,UPCOM,STOCK,XD Bảo tàng Hồ Chí Minh,Công ty Cổ phần Xây dựng Bảo tàng Hồ Chí Minh
HMR,HNX,STOCK,Đá Hoàng Mai,Công ty cổ phần Đá Hoàng Mai
HMH,HNX,STOCK,Tập đoàn Hải Minh,Công ty Cổ phần Hải Minh
HMG,UPCOM,STOCK,Kim Khí Hà Nội,Công ty Cổ phần Kim Khí Hà Nội - VNSTEEL
HMD,UPCOM,STOCK,Minh Duccsco,Công ty Cổ phần Hóa chất Minh Đức
HMC,HSX,STOCK,Kim khí TP.HCM,Công ty Cổ phần Kim khí Thành phố Hồ Chí Minh - VNSTEEL
HLY,UPCOM,STOCK,Gốm Xây Dựng Yên Hưng,Công ty Cổ phần Gốm xây dựng Yên Hưng
HLT,UPCOM,STOCK,Dệt may Hoàng Thị Loan,Công ty Cổ phần Dệt may Hoàng Thị Loan
HLS,UPCOM,STOCK,Sứ Hoàng Liên Sơn,Công ty Cổ phần Sứ kỹ thuật Hoàng Liên Sơn
HLR,DELISTED,STOCK,Đường sắt Hà Lạng,Công ty Cổ phần Đường sắt Hà Lạng
HLO,UPCOM,STOCK,Công Nghệ Ha Lô,Công Ty Cổ Phần Công Nghệ Ha Lô
HLG,DELISTED,STOCK,Tập đoàn Hoàng Long,Công ty Cổ phần Tập đoàn Hoàng Long
HLE,DELISTED,STOCK,Điện chiếu sáng Hải Phòng,Công ty Cổ phần Điện chiếu sáng Hải Phòng
HLD,HNX,STOCK,Bất động sản HUDLAND,Công ty Cổ phần Đầu tư và Phát triển Bất động sản HUDLAND
HLC,HNX,STOCK,Than Hà Lầm,Công ty Cổ phần Than Hà Lầm - Vinacomin
HLB,UPCOM,STOCK,Bia và NGK Hạ Long,Công ty Cổ phần Bia và Nước giải khát Hạ Long
HLA,UPCOM,STOCK,Hữu Liên Á Châu,Công ty Cổ phần Hữu Liên Á Châu
HKT,HNX,STOCK,Đầu tư QP Xanh,Công ty Cổ phần Đầu tư QP Xanh
HKP,DELISTED,STOCK,Bao bì Hà Tiên,Công ty Cổ phần Bao bì Hà Tiên
HKB,UPCOM,STOCK,Thực phẩm Hà Nội - Kinh Bắc,Công ty Cổ phần Nông nghiệp và Thực phẩm Hà Nội - Kinh Bắc
HJS,HNX,STOCK,Thủy điện Nậm Mu,Công ty Cổ phần Thủy điện Nậm Mu
HJC,UPCOM,STOCK,Công ty Cổ phần Hoà Việt,Công ty Cổ phần Hoà Việt
HIO,UPCOM,STOCK,Helio Energy,Công ty Cổ Phần Helio Energy
HII,HSX,STOCK,An Tiến Industries,Công ty Cổ phần An Tiến Industries
HIG,UPCOM,STOCK,Tập đoàn HIPT,Công ty Cổ phần Tập đoàn HIPT
HID,HSX,STOCK,Halcom Vietnam,Công ty Cổ phần Halcom Vietnam
HHV,HSX,STOCK,Đầu tư Hạ tầng Giao thông Đèo Cả,Công ty Cổ phần Đầu tư Hạ tầng Giao thông Đèo Cả
HHS,HSX,STOCK,Đầu tư DV Hoàng Huy,Công ty Cổ phần Đầu tư Dịch vụ Hoàng Huy
HHR,DELISTED,STOCK,Đường sắt Hà Hải,Công ty Cổ phần Đường sắt Hà Hải
HHP,HSX,STOCK,HHP Global,Công ty Cổ phần HHP Global
HHN,UPCOM,STOCK,Vận tải và DV Hàng hóa Hà Nội,Công ty Cổ phần Vận tải và Dịch vụ Hàng hóa Hà Nội
HHG,UPCOM,STOCK,Vận tải Hoàng Hà,Công ty Cổ phần Hoàng Hà
HHC,HNX,STOCK,Bánh kẹo Hải Hà,Công ty Cổ phần Bánh kẹo Hải Hà
HGW,DELISTED,STOCK,Công trình đô thị Hậu Giang,Công ty Cổ phần Cấp thoát nước - Công trình Đô thị Hậu Giang
HGT,UPCOM,STOCK,Du lịch Hương Giang,Công ty Cổ phần Du lịch Hương Giang
HGR,DELISTED,STOCK,,
HGM,HNX,STOCK,Khoáng sản Hà Giang,Công ty Cổ phần Cơ khí và Khoáng sản Hà Giang
HGC,DELISTED,STOCK,,
HGA,DELISTED,STOCK,,
HFX,UPCOM,STOCK,XNK Thanh Hà,Công ty Cổ phần Sản xuất - Xuất nhập khẩu Thanh Hà
HFC,UPCOM,STOCK,Xăng dầu HFC,Công ty Cổ phần Xăng dầu HFC
HFB,UPCOM,STOCK,Công trình Cầu phà TP HCM,Công ty Cổ phần Công trình Cầu phà Thành phố Hồ Chí Minh
HEV,HNX,STOCK,Sách Đại học - Dạy nghề,Công ty Cổ phần Sách Đại học - Dạy nghề
HES,UPCOM,STOCK,Dịch vụ Giải trí Hà Nội,Công ty Cổ phần Dịch vụ Giải trí Hà Nội
HEP,UPCOM,STOCK,Môi trường và Công trình đô thị Huế,Công ty Cổ phần Môi trường và Công trình đô thị Huế
HEM,DELISTED,STOCK,Chế tạo điện cơ Hà Nội,Công ty Cổ phần Chế tạo Điện cơ Hà Nội
HEJ,UPCOM,STOCK,Tư vấn Xây dựng Thủy Lợi VN,Tổng Công ty Tư vấn Xây dựng Thủy Lợi Việt Nam - CTCP
HEC,UPCOM,STOCK,Tư vấn XD Thủy Lợi II (HEC II),Công ty Cổ phần Tư vấn xây dựng Thủy Lợi II
HDW,UPCOM,STOCK,Nước sạch Hải Dương,Công ty Cổ phần Kinh doanh Nước sạch Hải Dương
HDS,UPCOM,STOCK,Giống cây trồng Hải Dương,Công ty Cổ phần Giống cây trồng Hải Dương
HDP,UPCOM,STOCK,Dược Hà Tĩnh,Công ty Cổ phần Dược Hà Tĩnh
HDO,UPCOM,STOCK,Hưng Đạo Container,Công ty Cổ phần Hưng Đạo Container
HDM,UPCOM,STOCK,Dệt May Huế,Công ty Cổ phần Dệt May Huế
HDG121001,DELISTED,BOND,HDG121001 - Trái phiếu,HDG121001 - Trái phiếu
HDG,HSX,STOCK,Tập đoàn Hà Đô,Công ty Cổ phần Tập đoàn Hà Đô
HDC,HSX,STOCK,Phát triển Nhà BR-VT,Công ty Cổ phần Phát triển Nhà Bà Rịa Vũng Tàu
HDB124023,BOND,BOND,HDB124023 - Trái phiếu,HDB124023 - Trái phiếu
HDB124018,BOND,BOND,HDB124018 - Trái phiếu,HDB124018 - Trái phiếu
HDB124006,BOND,BOND,HDB124006 - Trái phiếu,HDB124006 - Trái phiếu
HDB,HSX,STOCK,HDBank,Ngân hàng Thương mại Cổ phần Phát Triển Thành phố Hồ Chí Minh
HDA,HNX,STOCK,Hãng sơn Đông Á,Công ty Cổ phần Hãng sơn Đông Á
HD8,UPCOM,STOCK,PT Nhà và Đô thị HUD8,Công ty Cổ phần Đầu tư Phát triển Nhà và Đô thị HUD8
HD6,UPCOM,STOCK,Phát triển nhà số 6 Hà Nội,Công ty Cổ phần Đầu tư và Phát triển nhà số 6 Hà Nội
HD2,UPCOM,STOCK,Đầu tư phát triển nhà HUD 2,Công ty Cổ phần Đầu tư phát triển nhà HUD2
HCT,HNX,STOCK,TM - DV - Vận tải Xi măng Hải Phòng ,Công ty Cổ phần Thương mại - Dịch vụ - Vận tải Xi măng Hải Phòng
HCMA0307,DELISTED,DEBENTURE,,
HCM,HSX,STOCK,Chứng khoán HSC,Công ty Cổ phần Chứng khoán Thành phố Hồ Chí Minh
HCI,UPCOM,STOCK,Đầu tư - XD Hà Nội,Công ty Cổ phần Đầu tư - Xây dựng Hà Nội
HCD,HSX,STOCK,SX và Thương mại HCD,Công ty Cổ phần Đầu tư Sản xuất và Thương mại HCD
HCC,HNX,STOCK,Bê tông Hòa Cầm,Công ty Cổ phần Bê tông Hòa Cầm - Intimex
HCB,UPCOM,STOCK,Dệt may 29/3,Công ty Cổ phần Dệt may 29/3
HC3,UPCOM,STOCK,Xây dựng số 3 Hải Phòng,Công ty Cổ phần Xây dựng số 3 Hải Phòng
HC1,UPCOM,STOCK,Xây dựng số 1 Hà Nội,Công ty Cổ phần Xây dựng số 1 Hà Nội
HBS,HNX,STOCK,Chứng khoán Hòa Bình,Công ty Cổ phần Chứng khoán Hòa Bình
HBH,UPCOM,STOCK,HABECO Hải Phòng,Công ty Cổ phần HABECO - Hải Phòng
HBD,UPCOM,STOCK,Bao bì PP Bình Dương,Công ty Cổ phần Bao bì PP Bình Dương
HBC,UPCOM,STOCK,Tập đoàn Xây dựng Hòa Bình,Công ty Cổ phần Tập đoàn Xây dựng Hòa Bình
HAX,HSX,STOCK,Ô tô Hàng Xanh,Công ty Cổ phần Dịch vụ Ô tô Hàng Xanh
HAW,DELISTED,STOCK,,
HAV,UPCOM,STOCK,Rượu Hapro,Công ty Cổ phần Rượu Hapro
HAT,HNX,STOCK,TM Bia Hà Nội,Công ty Cổ phần Thương mại Bia Hà Nội
HAS,HSX,STOCK,Hacisco,Công ty Cổ phần Hacisco
HAR,HSX,STOCK,BĐS An Dương Thảo Điền,Công ty Cổ phần Đầu tư Thương mại Bất động sản An Dương Thảo Điền
HAP,HSX,STOCK,Tập đoàn Hapaco,Công ty Cổ phần Tập Đoàn Hapaco
HAN,UPCOM,STOCK,Xây dựng Hà Nội,Tổng Công ty Xây dựng Hà Nội - CTCP
HAM,UPCOM,STOCK,Vật tư Hậu Giang,Công ty Cổ phần Vật tư Hậu Giang
HAI,UPCOM,STOCK,Nông Dược HAI,Công ty Cổ phần Nông dược HAI
HAH,HSX,STOCK,Vận tải và Xếp dỡ Hải An,Công ty Cổ phần Vận tải và Xếp dỡ Hải An
HAG,HSX,STOCK,Hoàng Anh Gia Lai,Công ty Cổ phần Hoàng Anh Gia Lai
HAF,UPCOM,STOCK,Thực phẩm Hà Nội,Công ty Cổ phần Thực phẩm Hà Nội
HAD,HNX,STOCK,Bia Hà Nội - Hải Dương,Công ty Cổ phần Bia Hà Nội - Hải Dương
HAC,UPCOM,STOCK,Chứng khoán Hải Phòng,Công ty Cổ phần Chứng khoán Hải Phòng
HAB,DELISTED,STOCK,,
H11,UPCOM,STOCK,Xây dựng HUD101,Công ty Cổ phần Xây dựng HUD101
GVT,UPCOM,STOCK,Giấy Việt Trì,Công ty Cổ phần Giấy Việt Trì
GVR,HSX,STOCK,Tập đoàn CN Cao su VN,Tập đoàn Công nghiệp Cao su Việt Nam - Công ty Cổ phần
GTT,UPCOM,STOCK,Thuận Thảo Group,Công ty Cổ phần Thuận Thảo
GTS,UPCOM,STOCK,Công trình Giao thông Sài Gòn,Công ty Cổ phần Công trình Giao thông Sài Gòn
GTK,DELISTED,STOCK,,
GTH,DELISTED,STOCK,XD-GT Thừa Thiên Huế,Công ty Cổ phần Xây dựng Giao thông Thừa Thiên Huế
GTD,UPCOM,STOCK,Giầy Thượng Đình,Công ty Cổ phần Giầy Thượng Đình
GTA,HSX,STOCK,Gỗ Thuận An,Công ty Cổ phần Chế biến Gỗ Thuận An
GSP,HSX,STOCK,Vận tải Sản phẩm Khí Quốc tế,Công ty Cổ phần Vận tải Sản phẩm Khí Quốc tế
GSM,UPCOM,STOCK,Thủy điện Hương Sơn,Công ty Cổ phần Thủy điện Hương Sơn
GQN,DELISTED,STOCK,,
GPC,UPCOM,STOCK,Tập đoàn Green+,Công ty Cổ phần Tập đoàn Green+
GND,UPCOM,STOCK,Gạch ngói Đồng Nai,Công ty Cổ phần Gạch ngói Đồng Nai
GMX,HNX,STOCK,Gạch ngói Mỹ Xuân,Công ty Cổ phần Gạch ngói Gốm xây dựng Mỹ Xuân
GMH,HSX,STOCK,Minh Hưng Quảng Trị,Công ty Cổ phần Minh Hưng Quảng Trị
GMD,HSX,STOCK,Gemadept,Công ty Cổ phần Gemadept
GMC,UPCOM,STOCK,Garmex Sài Gòn,Công ty Cổ phần Garmex Sài Gòn
GMA,HNX,STOCK,G-Automobile,Công ty Cổ phần G-Automobile
GLW,UPCOM,STOCK,Cấp thoát nước Gia Lai,Công ty Cổ phần Cấp thoát nước Gia Lai
GLT,HNX,STOCK,KT Điện Toàn Cầu,Công ty Cổ phần Kỹ thuật điện Toàn Cầu
GLH121026,DELISTED,BOND,GLH121026 - Trái phiếu,GLH121026 - Trái phiếu
GLH121019,DELISTED,BOND,GLH121019 - Trái phiếu,GLH121019 - Trái phiếu
GLC,UPCOM,STOCK,Vàng Lào Cai,Công ty Cổ phần Vàng Lào Cai
GKM,HNX,STOCK,Khang Minh Group,Công ty Cổ phần GKM Holdings
GIL,HSX,STOCK,XNK Bình Thạnh,Công ty Cổ phần Sản xuất Kinh doanh Xuất nhập khẩu Bình Thạnh
GIC,HNX,STOCK,ĐT Dịch vụ và PT Xanh,Công ty Cổ phần VSC Green Logistics
GHC,UPCOM,STOCK,Thủy điện Gia Lai,Công ty Cổ phần Thủy điện Gia Lai
GH3,UPCOM,STOCK,Công trình giao thông Hà Nội,Công ty Cổ phần Công trình giao thông Hà Nội
GGG,UPCOM,STOCK,Ôtô Giải Phóng,Công ty Cổ phần Ô tô Giải Phóng
GEX,HSX,STOCK,Tập đoàn Gelex,Công ty Cổ phần Tập đoàn Gelex
GER,UPCOM,STOCK,Thể thao Ngôi sao Geru,Công ty Cổ phần Thể thao Ngôi sao Geru
GEG121022,DELISTED,BOND,GEG121022 - Trái phiếu,GEG121022 - Trái phiếu
GEG,HSX,STOCK,Điện Gia Lai,Công ty Cổ phần Điện Gia Lai
GEE,HSX,STOCK,Thiết bị điện GELEX,Công ty Cổ phần Điện lực Gelex
GE2,DELISTED,STOCK,Tổng Công ty Phát điện 2,Tổng Công ty Phát điện 2
GDW,HNX,STOCK,Cấp nước Gia Định,Công ty Cổ phần Cấp nước Gia Định
GDT,HSX,STOCK,Gỗ Đức Thành,Công ty Cổ phần Chế biến Gỗ Đức Thành
GDA,UPCOM,STOCK,Tôn Đông Á,Công ty Cổ phần Tôn Đông Á
GCF,UPCOM,STOCK,Thực phẩm G.C,Công ty Cổ phần Thực phẩm G.C
GCB,UPCOM,STOCK,PETEC Bình Định,Công ty Cổ phần PETEC Bình Định
GB10F2512,HNX,FU,GB10F2512 - HĐTL,GB10F2512 - HĐTL
GB10F2509,HNX,FU,GB10F2509 - HĐTL,GB10F2509 - HĐTL
GB10F2506,HNX,FU,GB10F2506 - HĐTL,GB10F2506 - HĐTL
GB10F2503,DELISTED,FU,GB10F2503 - HĐTL,GB10F2503 - HĐTL
GB10F2412,DELISTED,FU,GB10F2412 - HĐTL,GB10F2412 - HĐTL
GB10F2409,DELISTED,FU,GB10F2409 - HĐTL,GB10F2409 - HĐTL
GB10F2406,DELISTED,FU,GB10F2406 - HĐTL,GB10F2406 - HĐTL
GB10F2403,DELISTED,FU,GB10F2403 - HĐTL,GB10F2403 - HĐTL
GB10F2312,DELISTED,FU,GB10F2312 - HĐTL,GB10F2312 - HĐTL
GB10F2309,DELISTED,FU,GB10F2309 - HĐTL,GB10F2309 - HĐTL
GB10F2306,DELISTED,FU,GB10F2306 - HĐTL,GB10F2306 - HĐTL
GB10F2303,DELISTED,FU,GB10F2303 - HĐTL,GB10F2303 - HĐTL
GB10F2212,DELISTED,FU,GB10F2212 - HĐTL,GB10F2212 - HĐTL
GB10F2209,DELISTED,FU,GB10F2209 - HĐTL,GB10F2209 - HĐTL
GB10F2206,DELISTED,FU,GB10F2206 - HĐTL,GB10F2206 - HĐTL
GB05F2512,HNX,FU,GB05F2512 - HĐTL,GB05F2512 - HĐTL
GB05F2509,HNX,FU,GB05F2509 - HĐTL,GB05F2509 - HĐTL
GB05F2506,HNX,FU,GB05F2506 - HĐTL,GB05F2506 - HĐTL
GB05F2503,DELISTED,FU,GB05F2503 - HĐTL,GB05F2503 - HĐTL
GB05F2412,DELISTED,FU,GB05F2412 - HĐTL,GB05F2412 - HĐTL
GB05F2409,DELISTED,FU,GB05F2409 - HĐTL,GB05F2409 - HĐTL
GB05F2406,DELISTED,FU,GB05F2406 - HĐTL,GB05F2406 - HĐTL
GB05F2403,DELISTED,FU,GB05F2403 - HĐTL,GB05F2403 - HĐTL
GB05F2312,DELISTED,FU,GB05F2312 - HĐTL,GB05F2312 - HĐTL
GB05F2309,DELISTED,FU,GB05F2309 - HĐTL,GB05F2309 - HĐTL
GB05F2306,DELISTED,FU,GB05F2306 - HĐTL,GB05F2306 - HĐTL
GB05F2303,DELISTED,FU,GB05F2303 - HĐTL,GB05F2303 - HĐTL
GB05F2212,DELISTED,FU,GB05F2212 - HĐTL,GB05F2212 - HĐTL
GB05F2209,DELISTED,FU,GB05F2209 - HĐTL,GB05F2209 - HĐTL
GB05F2206,DELISTED,FU,GB05F2206 - HĐTL,GB05F2206 - HĐTL
GAS,HSX,STOCK,PV Gas,Tổng Công ty Khí Việt Nam - Công ty Cổ phần
GAB,UPCOM,STOCK,ĐT Khai khoáng và QL Tài sản FLC,Công ty Cổ phần Đầu tư Khai khoáng & Quản lý Tài sản FLC
G36,UPCOM,STOCK,Tổng Công ty 36,Tổng Công ty 36 - Công ty Cổ phần
G20,UPCOM,STOCK,Đầu tư Dệt may Vĩnh Phúc,Công ty Cổ phần Đầu tư Dệt may Vĩnh Phúc
FUEVN100,HSX,ETF,FUEVN100 - ETF,FUEVN100 - ETF
FUEVFVND,HSX,ETF,FUEVFVND - ETF,FUEVFVND - ETF
FUETCC50,HSX,ETF,FUETCC50 - ETF,FUETCC50 - ETF
FUESSVFL,HSX,ETF,FUESSVFL - ETF,FUESSVFL - ETF
FUESSV50,HSX,ETF,FUESSV50 - ETF,FUESSV50 - ETF
FUESSV30,HSX,ETF,FUESSV30 - ETF,FUESSV30 - ETF
FUEMAVND,HSX,ETF,FUEMAVND - ETF,FUEMAVND - ETF
FUEMAV30,HSX,ETF,FUEMAV30 - ETF,FUEMAV30 - ETF
FUEKIVND,HSX,ETF,FUEKIVND - ETF,FUEKIVND - ETF
FUEKIVFS,HSX,ETF,FUEKIVFS - ETF,FUEKIVFS - ETF
FUEKIV30,HSX,ETF,FUEKIV30 - ETF,FUEKIV30 - ETF
FUEIP100,HSX,ETF,FUEIP100 - ETF,FUEIP100 - ETF
FUEFCV50,HSX,ETF,FUEFCV50 - ETF,FUEFCV50 - ETF
FUEDCMID,HSX,ETF,FUEDCMID - ETF,FUEDCMID - ETF
FUEBFVND,HSX,ETF,FUEBFVND - ETF,FUEBFVND - ETF
FUEABVND,HSX,ETF,FUEABVND - ETF,FUEABVND - ETF
FUCVREIT,HSX,UNIT_TRUST,FUCVREIT,FUCVREIT
FUCTVGF5,HSX,UNIT_TRUST,FUCTVGF5,FUCTVGF5
FUCTVGF4,HSX,UNIT_TRUST,FUCTVGF4,FUCTVGF4
FUCTVGF3,HSX,UNIT_TRUST,FUCTVGF3,FUCTVGF3
FTS,HSX,STOCK,Chứng khoán FPT,Công ty Cổ phần Chứng khoán FPT
FTM,UPCOM,STOCK,Phát triển Đức Quân,Công ty Cổ phần Đầu tư và Phát triển Đức Quân
FTI,UPCOM,STOCK,Công nghiệp - Thương mại Hữu Nghị,Công ty Cổ phần Công nghiệp - Thương mại Hữu Nghị
FT1,UPCOM,STOCK,Phụ tùng máy số 1,Công ty Cổ phần Phụ tùng máy số 1
FSO,UPCOM,STOCK,Đóng tàu thủy sản VN,Công ty Cổ phần Cơ khí đóng tàu thủy sản Việt Nam
FRT,HSX,STOCK,Bán lẻ FPT,Công ty Cổ phần Bán lẻ Kỹ thuật số FPT
FRM,UPCOM,STOCK,Lâm nghiệp Sài Gòn,Công ty Cổ phần Lâm nghiệp Sài Gòn
FRC,UPCOM,STOCK,Lâm đặc sản xuất khẩu Quảng Nam,Công ty Cổ phần Lâm đặc sản xuất khẩu Quảng Nam
FPT,HSX,STOCK,FPT Corp,Công ty Cổ phần FPT
FOX,UPCOM,STOCK,FPT Telecom,Công ty Cổ phần Viễn thông FPT
FOC,UPCOM,STOCK,FPT Online,Công ty Cổ phần Dịch vụ Trực tuyến FPT
FMC,HSX,STOCK,Thực phẩm Sao Ta,Công ty Cổ phần Thực phẩm Sao Ta
FLC,UPCOM,STOCK,Tập đoàn FLC,Công ty Cổ phần Tập đoàn FLC
FIT,HSX,STOCK,Tập đoàn F.I.T,Công ty Cổ phần Tập đoàn F.I.T
FIR,HSX,STOCK,Địa ốc First Real,Công ty Cổ phần Địa ốc First Real
FID,HNX,STOCK,Đầu tư và PT doanh nghiệp VN,Công ty Cổ phần Đầu tư và Phát triển Doanh nghiệp Việt Nam
FIC,UPCOM,STOCK,VLXD số 1,Tổng Công ty Vật liệu Xây dựng số 1 - Công ty Cổ phần
FHS,UPCOM,STOCK,Phát hành sách TP HCM - FAHASA,Công ty Cổ phần Phát hành sách Thành phố Hồ Chí Minh - FAHASA
FHN,UPCOM,STOCK,XNK lương thực Hà Nội,Công ty Cổ phần Xuất nhập khẩu Lương thực - Thực phẩm Hà Nội
FGL,UPCOM,STOCK,Cà Phê Gia Lai,Công ty Cổ phần Cà phê Gia Lai
FDG,DELISTED,STOCK,Thủy sản Docimexco,Công ty Cổ phần Docimexco
FDC,HSX,STOCK,FIDECO,Công ty Cổ phần Ngoại thương và Phát triển Đầu tư Thành phố Hồ Chí Minh
FCS,UPCOM,STOCK,Lương thực TP Hồ Chí Minh,Công ty Cổ phần Lương thực Thành phố Hồ Chí Minh
FCN,HSX,STOCK,FECON CORP,Công ty Cổ phần FECON
FCM,HSX,STOCK,Khoáng sản FECON,Công ty Cổ phần Khoáng sản FECON
FCC,UPCOM,STOCK,Liên hợp Thực phẩm,Công ty Cổ phần Liên hợp Thực phẩm
FBC,UPCOM,STOCK,Cơ khí Phổ Yên,Công ty Cổ phần Cơ khí Phổ Yên
FBA,UPCOM,STOCK,Tập đoàn Quốc tế FBA,Công ty Cổ phần Tập đoàn Quốc tế FBA
EVS,HNX,STOCK,Chứng khoán Everest,Công ty Cổ phần Chứng khoán Everest
EVG,HSX,STOCK,Tập đoàn Everland,Công ty Cổ phần Tập đoàn Everland
EVF,HSX,STOCK,Tài chính Điện lực,Công ty Tài chính Cổ phần Điện Lực
EVE,HSX,STOCK,Everpia,Công ty Cổ phần Everpia
EPH,UPCOM,STOCK,Xuất bản giáo dục Hà Nội,Công ty Cổ phần Dịch vụ Xuất bản Giáo dục Hà Nội
EPC,UPCOM,STOCK,Cà Phê Ea Pốk,Công ty Cổ phần Cà Phê Ea Pốk
EMS,UPCOM,STOCK,Chuyển phát nhanh Bưu điện,Tổng Công ty Chuyển phát nhanh Bưu điện - Công ty Cổ phần
EMG,UPCOM,STOCK,Thiết bị phụ tùng cơ điện,Công ty Cổ phần Thiết bị Phụ tùng Cơ điện
EME,UPCOM,STOCK,Điện Cơ,Công ty Cổ phần Điện Cơ
EMC,DELISTED,STOCK,Cơ điện Thủ Đức,Công ty Cổ phần Cơ điện Thủ Đức
ELC,HSX,STOCK,ELCOM,Công ty Cổ phần Công nghệ - Viễn thông ELCOM
EIN,UPCOM,STOCK,Đầu tư - TM - DV Điện lực,Công ty Cổ phần Đầu tư - Thương Mại - Dịch vụ Điện lực
EID,HNX,STOCK,Phát triển GD Hà Nội,Công ty Cổ phần Đầu tư và Phát triển Giáo dục Hà Nội
EIC,UPCOM,STOCK,EVN Quốc Tế,Công ty Cổ phần EVN Quốc Tế
EIB,HSX,STOCK,Eximbank,Ngân hàng Thương mại Cổ phần Xuất nhập khẩu Việt Nam
EFI,UPCOM,STOCK,Tài chính giáo dục,Công ty Cổ phần Đầu tư Tài chính Giáo dục
ECO,UPCOM,STOCK,Ecoplastic VN,Công ty Cổ Phần Nhựa Sinh Thái Việt Nam
ECI,HNX,STOCK,Bản đồ và tranh ảnh GD,Công ty Cổ phần Tập đoàn ECI
EBS,HNX,STOCK,Sách Giáo dục Hà Nội,Công ty Cổ phần Sách Giáo dục tại Thành phố Hà Nội
EAD,DELISTED,STOCK,Điện lực Đắk Lắk,Công ty Cổ phần Thủy điện Điện lực Đắk Lắk
E29,UPCOM,STOCK,Đầu tư XD và Kỹ thuật 29,Công ty cổ phần Đầu tư Xây dựng và Kỹ thuật 29
E1VFVN30,HSX,ETF,E1VFVN30 - ETF,E1VFVN30 - ETF
E12,UPCOM,STOCK,XD Điện VNECO 12,Công ty Cổ phần Xây Dựng Điện VNECO 12
DZM,UPCOM,STOCK,Cơ điện Dzĩ An,Công ty Cổ phần Cơ điện Dzĩ An
DXV,HSX,STOCK,Vật liệu Xây dựng Đà Nẵng,Công ty Cổ phần VICEM Vật liệu Xây dựng Đà Nẵng
DXS,HSX,STOCK,Dịch vụ BĐS Đất Xanh,Công ty Cổ phần Dịch vụ Bất động sản Đất Xanh
DXP,HNX,STOCK,Cảng Đoạn Xá,Công ty Cổ phần Cảng Đoạn Xá
DXL,UPCOM,STOCK,Du lịch và Xuất nhập khẩu Lạng Sơn,Công ty Cổ phần Du lịch và Xuất nhập khẩu Lạng Sơn
DXG,HSX,STOCK,Địa ốc Đất Xanh,Công ty Cổ phần Tập đoàn Đất Xanh
DX2,DELISTED,STOCK,,
DWS,UPCOM,STOCK,Cấp nước Đồng Tháp,Công ty Cổ phần Cấp nước và Môi trường Đô thị Đồng Tháp
DWC,UPCOM,STOCK,Cấp nước Đắk Lắk,Công ty Cổ phần Cấp nước Đắk Lắk
DVW,UPCOM,STOCK,DV và XD cấp nước Đồng Nai,Công ty Cổ phần Dịch vụ và Xây dựng cấp nước Đồng Nai
DVP,HSX,STOCK,ĐT và PT Cảng Đình Vũ,Công ty Cổ phần Đầu tư và Phát triển Cảng Đình Vũ
DVN,UPCOM,STOCK,Tổng Công ty Dược Việt Nam,Tổng Công ty Dược Việt Nam - CTCP
DVM,HNX,STOCK,Dược liệu Việt Nam,Công ty Cổ phần Dược liệu Việt Nam
DVG,UPCOM,STOCK,Tập đoàn Sơn Đại Việt,Công ty Cổ phần Đại Việt Group DVG
DVC,UPCOM,STOCK,TM dịch vụ Cảng Hải Phòng,Công ty Cổ phần Thương mại dịch vụ Tổng Hợp Cảng Hải Phòng
DUS,UPCOM,STOCK,Dịch vụ Đô thị Đà Lạt,Công ty Cổ phần Dịch vụ Đô thị Đà Lạt
DTV,DELISTED,STOCK,PT điện Nông thôn Trà Vinh,Công ty Cổ phần Phát triển điện Trà Vinh
DTT,HSX,STOCK,Kỹ nghệ Đô Thành,Công ty Cổ phần Kỹ nghệ Đô Thành
DTP,UPCOM,STOCK,Dược phẩm CPC1 Hà Nội,Công ty Cổ phần Dược phẩm CPC1 Hà Nội
DTL,HSX,STOCK,Đại Thiên Lộc,Công ty Cổ phần Đại Thiên Lộc
DTK,HNX,STOCK,Vinacomin Power,Tổng Công ty Điện lực TKV - Công ty Cổ phần
DTI,UPCOM,STOCK,Đầu tư Đức Trung,Công ty Cổ phần Đầu tư Đức Trung
DTH,UPCOM,STOCK,Vật tư Y tế Thanh Hóa,Công ty Cổ phần Dược - Vật tư Y tế Thanh Hóa
DTG,HNX,STOCK,Dược phẩm Tipharco,Công ty Cổ phần Dược phẩm Tipharco
DTE,UPCOM,STOCK,Đại Trường Thành Holdings,Công ty Cổ phần Đầu tư Năng lượng Đại Trường Thành Holdings
DTD,HNX,STOCK,Đầu tư Phát triển Thành Đạt,Công ty Cổ phần Đầu tư Phát triển Thành Đạt
DTC,UPCOM,STOCK,Viglacera Đông Triều,Công ty Cổ phần Viglacera Đông Triều
DTB,UPCOM,STOCK,Công trình Đô thị Bảo Lộc,Công ty Cổ phần Công trình Đô thị Bảo Lộc
DTA,HSX,STOCK,BĐS Đệ Tam,Công ty Cổ phần Đệ Tam
DT4,DELISTED,STOCK,Bảo trì đường thủy nội địa số 4,Công ty Cổ phần Quản lý Đường sông số 4
DSV,DELISTED,STOCK,Đường sắt Vĩnh Phú,Công ty Cổ phần Đường sắt Vĩnh Phú
DST,HNX,STOCK,Đầu tư Sao Thăng Long,Công ty Cổ phần Đầu tư Sao Thăng Long
DSP,UPCOM,STOCK,Dịch vụ Du lịch Phú Thọ,Công ty Cổ phần Dịch vụ Du lịch Phú Thọ
DSN,HSX,STOCK,Công viên nước Đầm Sen,Công ty Cổ phần Công viên nước Đầm Sen
DSG,UPCOM,STOCK,Kính Đáp Cầu,Công ty Cổ phần Kính Đáp Cầu
DSE,HSX,STOCK,Chứng Khoán DNSE,Công ty Cổ phần Chứng khoán DNSE
DSD,UPCOM,STOCK,DHC Suối Đôi,Công ty cổ phần DHC Suối Đôi
DSC,HSX,STOCK,Chứng khoán DSC,Công ty Cổ phần Chứng khoán DSC
DS3,HNX,STOCK,Quản lý Đường sông số 3,Công ty Cổ phần DS3
DRL,HSX,STOCK,Thủy điện - Điện lực 3,Công ty Cổ phần Thủy điện - Điện lực 3
DRI,UPCOM,STOCK,Đầu tư Cao su Đắk Lắk,Công ty Cổ phần Đầu tư Cao su Đắk Lắk
DRH,HSX,STOCK,DRH Holdings,Công ty Cổ phần DRH Holdings
DRG,UPCOM,STOCK,Cao su Đắk Lắk,Công ty Cổ phần Cao su Đắk Lắk
DRC,HSX,STOCK,Cao su Đà Nẵng,Công ty Cổ phần Cao su Đà Nẵng
DQC,HSX,STOCK,Tập đoàn Điện Quang,Công ty Cổ phần Tập đoàn Điện Quang
DPS,UPCOM,STOCK,Đầu tư Phát triển Sóc Sơn,Công ty Cổ phần Đầu tư Phát triển Sóc Sơn
DPR,HSX,STOCK,Cao su Đồng Phú,Công ty Cổ phần Cao su Đồng Phú
DPP,UPCOM,STOCK,Dược Đồng Nai,Công ty Cổ phần Dược Đồng Nai
DPM,HSX,STOCK,Tổng Công ty Phân bón và Hóa chất Dầu khí,Tổng Công ty Phân bón và Hóa chất Dầu khí - Công ty Cổ phần
DPH,UPCOM,STOCK,Dược phẩm Hải Phòng,Công ty Cổ phần Dược phẩm Hải Phòng
DPG,HSX,STOCK,Tập đoàn Đạt Phương,Công ty Cổ phần Tập đoàn Đạt Phương
DPD,DELISTED,STOCK,Cao su Đồng Phú Đắk Nông,Công ty cổ phần Cao su Đồng Phú - Đắk Nông
DPC,UPCOM,STOCK,Nhựa Đà Nẵng,Công ty Cổ phần Nhựa Đà Nẵng
DP3,HNX,STOCK,Dược Phẩm TW3,Công ty Cổ Phần Dược Phẩm Trung Ương 3
DP2,UPCOM,STOCK,Dược phẩm TW 2,Công ty Cổ phần Dược phẩm Trung ương 2
